Solution,Type,Cost,Pros,Cons,Best For,RSS Support,Automation,Difficulty
Custom Python Script,DIY/Open Source,Free,"Full control, customizable, no external dependencies, learn Python","Requires coding, maintenance needed, manual setup","Developers, tech enthusiasts, full customization needs",Full (feedparser),schedule/cron,Medium
Calibre Desktop,Desktop Software,Free,"Powerful, extensive recipe library, offline, free","Must keep computer running, desktop-only, GUI required","Power users, large ebook libraries, offline use",Excellent (1000+ recipes),Built-in scheduler,Easy
KindleEar,Web Application,Free (hosting cost),"Web interface, multi-user, Calibre recipe support, cloud-based","Requires server/VPS, complex deployment, maintenance","Tech-savvy users, multiple users/devices, cloud preference",Excellent (Calibre recipes),Built-in scheduler,Hard
kindle4rss.com,Paid Service,$4.99/month,"Zero setup, reliable, automatic delivery","Monthly cost, limited customization, depends on service","Non-technical users, convenience over cost",Basic,Automatic,Very Easy
Instapaper,Paid Service,$2.99/month,"Read-later service, browser extension, mobile apps","Limited to saved articles, not full RSS automation","Read-later workflow, cross-platform syncing",No (manual save),Manual,Easy
